{
  "schema_version": "evidence-package@2.2",
  "spec_version": "devtask.execution@1.0",
  "bundle_id": "evidence-2-3-canary-downgrade",
  "capability": "devtask.execution@1.0",
  "run_id": "evidence-2-3-canary-downgrade:1",
  "claim_ladder": "L2",
  "executed_at": "2026-09-27T21:54:08.363Z",
  "trace_events": [
    "devtask_contract_bound:{\"task_id\":\"evidence-2-3-canary-downgrade\",\"attempt_number\":1,\"contract_hash\":\"747acb6d5d887fdfc2ec8079c8ae035eb275d9a99def11812db670684e38af43\",\"contract_schema_version\":\"work-contract@1.0\",\"risk_class\":\"R1\"}",
    "devtask_attempt_started:{\"task_id\":\"evidence-2-3-canary-downgrade\",\"attempt_number\":1,\"started_at\":\"2026-09-28T00:00:00Z\"}",
    "devtask_execution_context:{\"task_id\":\"evidence-2-3-canary-downgrade\",\"attempt_number\":1,\"execution_reference\":\"attempt:1\",\"sandbox_reference\":null}",
    "devtask_validation:{\"task_id\":\"evidence-2-3-canary-downgrade\",\"attempt_number\":1,\"validation_status\":\"passed\",\"validation_reference\":\"validation:1\"}",
    "devtask_diff_evidence:{\"task_id\":\"evidence-2-3-canary-downgrade\",\"attempt_number\":1,\"diff_stat_sha256\":\"40460da8c882cdc791836fba76009870f960a151287798f1df8af5e963398f84\",\"diff_full_sha256\":\"df087996d45b03e7eb8c133c0298fd98d35113fca26aaba58612fef3cc212cad\",\"scope\":\"diff_stat_and_full\"}",
    "devtask_outcome:{\"task_id\":\"evidence-2-3-canary-downgrade\",\"attempt_number\":1,\"outcome\":\"ABORTED\",\"completed_at\":\"2026-09-28T00:01:00Z\"}"
  ],
  "trace_hash_chain": [
    "e2755dd6e6b261c26dc8d753280950784945eea849f3759a30886e5a5fc7a7a5",
    "b5034a3edb6a36932b175985a7ca830925a66059a0ebdd1d309f4a83c7b05bb8",
    "e277db6aba92af11035b4086846710351883fa3833cbc0ddeded4c5b0d5c372c",
    "272f8ff5ca069398b4d974262b99a4f0cd10c494322f028a167218350b186b5a",
    "614f354bfc87e713d23bd8e30732e0bcfb4cba2ea55d0fd7b3c24ef628a92778",
    "15011c7dc5c3a6ce28cfd9d7af3857918b9dfa6d36af03168a48877b615023f7"
  ],
  "outcome": "verified",
  "signer_key_id": "ed25519:6920d2455a0674889932c505bed1e95457a0e0def1879996916d26a419ea0a85",
  "controller_evidence": {
    "producer": "privileged_controller",
    "task_id": "evidence-2-3-canary-downgrade",
    "attempt_number": 1,
    "base_commit": "abc",
    "result_reference": null,
    "policy_snapshot_sha256": "sha256:bbbbbbbbbbbbbbbbbbbbbbbbbbbbbbbbbbbbbbbbbbbbbbbbbbbbbbbbbbbbbbbb",
    "diff_stat_sha256": "40460da8c882cdc791836fba76009870f960a151287798f1df8af5e963398f84",
    "diff_full": "diff",
    "diff_full_sha256": "df087996d45b03e7eb8c133c0298fd98d35113fca26aaba58612fef3cc212cad",
    "execution_reference": "attempt:1",
    "validation_reference": "validation:1",
    "approval_reference": null,
    "sandbox_reference": null,
    "sandbox_attestation": null,
    "agent_run_id": null,
    "contract_snapshot": {
      "schemaVersion": "work-contract@1.0",
      "rawText": "Oeffentliches Canary-Bundle fuer evidence-package@2.3 (Iman/EMILIA-Feedback).",
      "acceptanceCriteria": [
        "ok"
      ],
      "protectExistingTests": true
    }
  },
  "required_evidence": [
    "contract",
    "attempt",
    "execution_context",
    "validation",
    "outcome",
    "base_commit",
    "diff_full"
  ],
  "approval_attestation_required": false,
  "signature": "uHUfX1WWI8IQslPwLyXgvPBT5sf/6htHISWDv3v04Z3tu3nr37YeZKRGpkH86uwZfpfn5LuyUSqDpyCAnsMNAg==",
  "public_key": "-----BEGIN PUBLIC KEY-----\nMCowBQYDK2VwAyEA7ne5p+CojXWK66SIZl3MuGoyZ/X6WkWNG+ldf8TASWM=\n-----END PUBLIC KEY-----\n"
}
