{
  "schema_version": "evidence-package@2.3",
  "spec_version": "devtask.execution@1.0",
  "bundle_id": "evidence-2-3-canary-b",
  "capability": "devtask.execution@1.0",
  "run_id": "evidence-2-3-canary-b:1",
  "claim_ladder": "L2",
  "executed_at": "2026-09-27T21:54:08.356Z",
  "trace_events": [
    "devtask_contract_bound:{\"task_id\":\"evidence-2-3-canary-b\",\"attempt_number\":1,\"contract_hash\":\"747acb6d5d887fdfc2ec8079c8ae035eb275d9a99def11812db670684e38af43\",\"contract_schema_version\":\"work-contract@1.0\",\"risk_class\":\"R1\"}",
    "devtask_attempt_started:{\"task_id\":\"evidence-2-3-canary-b\",\"attempt_number\":1,\"started_at\":\"2026-09-28T00:00:00Z\"}",
    "devtask_execution_context:{\"task_id\":\"evidence-2-3-canary-b\",\"attempt_number\":1,\"execution_reference\":\"attempt:1\",\"sandbox_reference\":null}",
    "devtask_validation:{\"task_id\":\"evidence-2-3-canary-b\",\"attempt_number\":1,\"validation_status\":\"passed\",\"validation_reference\":\"validation:1\"}",
    "devtask_diff_evidence:{\"task_id\":\"evidence-2-3-canary-b\",\"attempt_number\":1,\"diff_stat_sha256\":\"40460da8c882cdc791836fba76009870f960a151287798f1df8af5e963398f84\",\"diff_full_sha256\":\"df087996d45b03e7eb8c133c0298fd98d35113fca26aaba58612fef3cc212cad\",\"scope\":\"diff_stat_and_full\"}",
    "devtask_outcome:{\"task_id\":\"evidence-2-3-canary-b\",\"attempt_number\":1,\"outcome\":\"ABORTED\",\"completed_at\":\"2026-09-28T00:01:00Z\"}"
  ],
  "trace_hash_chain": [
    "7454f205aebddd651a09db7b945b45277bfbf18d2acaef5666c6009612b5d655",
    "f4a6b72af482ffb70d0108b153348133c2d87cfe262e5094ccd0f7e38be86f4f",
    "39793bf15c8b847f0822dbd9525a71ac6dd05f69afd30a16ac607b19154c4f92",
    "2ef920e16cb0bbba4fa671119bae143211ac86827bb44594bac49733cf2c6ef4",
    "94b8a6ad5dd2bc03d0d68a3a2a428ed2d27ce22e464083e53dd70bdf6cd62d4b",
    "f551efb3b10f15a68ecdd9909d17b4c602459f0c5912bbbc820310d2f976ff1c"
  ],
  "outcome": "verified",
  "signer_key_id": "ed25519:6920d2455a0674889932c505bed1e95457a0e0def1879996916d26a419ea0a85",
  "controller_evidence": {
    "producer": "privileged_controller",
    "task_id": "evidence-2-3-canary-b",
    "attempt_number": 1,
    "base_commit": "abc",
    "result_reference": null,
    "policy_snapshot_sha256": "sha256:bbbbbbbbbbbbbbbbbbbbbbbbbbbbbbbbbbbbbbbbbbbbbbbbbbbbbbbbbbbbbbbb",
    "diff_stat_sha256": "40460da8c882cdc791836fba76009870f960a151287798f1df8af5e963398f84",
    "diff_full": "diff",
    "diff_full_sha256": "df087996d45b03e7eb8c133c0298fd98d35113fca26aaba58612fef3cc212cad",
    "execution_reference": "attempt:1",
    "validation_reference": "validation:1",
    "approval_reference": null,
    "sandbox_reference": null,
    "sandbox_attestation": null,
    "agent_run_id": null,
    "contract_snapshot": {
      "schemaVersion": "work-contract@1.0",
      "rawText": "Oeffentliches Canary-Bundle fuer evidence-package@2.3 (Iman/EMILIA-Feedback).",
      "acceptanceCriteria": [
        "ok"
      ],
      "protectExistingTests": true
    }
  },
  "required_evidence": [
    "contract",
    "attempt",
    "execution_context",
    "validation",
    "outcome",
    "base_commit",
    "diff_full"
  ],
  "approval_attestation_required": false,
  "signature": "HeJBNMNZTn+8jkUGUgJ3Zvh4B6B1Hk9TRFylalGcCSvpIW50kZHnzkAoBMaFJiggcO8cKYR6E7O0itnTym1dBQ==",
  "public_key": "-----BEGIN PUBLIC KEY-----\nMCowBQYDK2VwAyEA7ne5p+CojXWK66SIZl3MuGoyZ/X6WkWNG+ldf8TASWM=\n-----END PUBLIC KEY-----\n",
  "epistemic_gate": {
    "schema_version": "epistemic-gate-attestation@1.0",
    "gate": {
      "schema_version": "epistemic-gate@1.0",
      "score": 0,
      "threshold": 0.34,
      "blind_modules": [],
      "decision": "acted",
      "evaluated_at": "2026-09-27T21:54:08.350Z"
    },
    "bundle_sha256": "0c37f0c47e9cd13e663352cab690abd650368057e70851def37621efa174b2e0",
    "signer_key_id": "ed25519:6920d2455a0674889932c505bed1e95457a0e0def1879996916d26a419ea0a85",
    "public_key": "-----BEGIN PUBLIC KEY-----\nMCowBQYDK2VwAyEA7ne5p+CojXWK66SIZl3MuGoyZ/X6WkWNG+ldf8TASWM=\n-----END PUBLIC KEY-----\n",
    "signature": "My81IaOOEOSYm6currTMKHeCm85zbyXosDeZ9r4C+ADYN6mQgfjUKcvaimgxMiqIu2kaUYDx8H7ZN0UNL6jTAg=="
  }
}
